{
  "findings": {
    "technicalFeasibility": {
      "verdict": "high",
      "rationale": "Every proposed component (gamification, adaptive difficulty, AI pronunciation feedback, AI conversation practice, mistake analysis, personalized paths) is already shipping in production apps in 2025 — integration-and-content problem, not a research problem. ASR-based pronunciation scoring is a solved category (ELSA Speak); LLM-driven roleplay conversation with grammar/pronunciation correction is now standard (Duolingo Max, Loora, Speakerly). Genuine engineering risk: (a) India-specific latency/performance on entry-level Android devices, (b) tuning ASR for Indian/Gujarati-accented English so feedback is fair not punitive.",
      "evidence": [
        "ELSA Speak uses accent-aware speech recognition for real-time syllable-level pronunciation feedback and interactive AI conversation.",
        "Duolingo Max ships AI Roleplay, Video Calls with AI agents, 'Explain My Answer'; Loora, Speakerly, SmallTalk2Me provide real-time AI conversation with correction.",
        "Duolingo's gamification stack (streaks, XP, leaderboards) drives ~3x daily-return likelihood, ~15% more lesson completions.",
        "ELSA's self-evolving AI personalizes daily curriculum — adaptive difficulty already deployed, not novel R&D.",
        "India-specific risk: ~39% of users on entry-level Android waited >5s for app start in early 2024; slow load times cause quits."
      ]
    },
    "marketViability": {
      "verdict": "medium",
      "rationale": "Demand is real and economically grounded, but crowded, low-ARPU market where monetization — not demand — is the binding constraint. Tailwinds: India has 250M+ English learners, APAC ~46% of 2025 online-language-learning revenue, global market ~$7.4B (2025, ~16% CAGR), English fluency raises Indian male wages ~34%. Gujarati-medium students documented as grammar-strong but fluency-weak, fitting the intermediate-start thesis. BUT: heavily contested by India-native incumbents (Hello English/CultureAlley, Josh Talks, Awal, Entri) plus global players (Duolingo, ELSA, Cambly). ARPU is brutal: Duolingo's international users >70% of base but <30% of revenue; freemium conversion typically 1-5%.",
      "evidence": [
        "English fluency raises hourly wages ~34% for men (22% women) in India — quantified demand driver (CEPR/Journal of Economic Development).",
        "India has 250M+ English learners; APAC ~45.75% of 2025 online-language-learning revenue; global market ~$7.36B (2025) to ~$24.4B by 2033 (~16% CAGR).",
        "Documented gap: Gujarati-medium students strong in grammar/syntax, weak in spoken fluency/confidence — supports intermediate-start, practical-spoken positioning.",
        "Analyst note: gamification 'feels like obligation rather than reward' at B1+ — acknowledged gap but also warning retention is hardest exactly at this idea's target level.",
        "Crowded field: Hello English (CultureAlley, 20+ Indian languages), Josh Talks (90-day Hindi-to-English + AI feedback), Awal (Hindi-first, near-billion social reach), Entri (5M+ users).",
        "Monetization risk: Duolingo intl users >70% of base but <30% revenue; ~$3.20 annual ARPU emerging markets; freemium conversion 1-5%."
      ]
    },
    "founderFit": {
      "verdict": "unknown",
      "rationale": "No founder profile provided — flag as open question. Fit would be strongest with existing audience/distribution in Gujarati learner community (Awal/Josh Talks playbook is audience-led) and/or ability to solve low-end-device performance and low-ARPU monetization."
    },
    "recommendation": "proceed"
  },
  "confidence": 0.62,
  "sources": [
    { "type": "report", "description": "Straits Research/Mordor Intelligence/Business of Apps — global language-learning market (~$7.36B 2025, ~16% CAGR to ~$24.4B by 2033; APAC ~45.75% of 2025 revenue)", "credibility": 0.7 },
    { "type": "public-data", "description": "CEPR VoxEU / Journal of Economic Development & Cultural Change — returns to English skills in India (~34% wage premium)", "credibility": 0.85 },
    { "type": "benchmark", "description": "ELSA Speak product pages — accent-aware ASR pronunciation scoring, adaptive curriculum, AI conversation practice", "credibility": 0.6 },
    { "type": "benchmark", "description": "Duolingo gamification case studies and Duolingo Max feature docs — streak/XP/leaderboard retention effects, shipped AI Roleplay", "credibility": 0.6 },
    { "type": "public-data", "description": "Duolingo 2025/2026 financial analyses — emerging-market ARPU problem (India top-5 market, >70% users/<30% revenue)", "credibility": 0.55 },
    { "type": "report", "description": "India competitor landscape — Hello English/CultureAlley, Josh Talks, Awal, Entri (StartupTalky, YourStory, Tracxn)", "credibility": 0.55 },
    { "type": "report", "description": "Gujarat English-proficiency/medium-of-instruction analyses — Gujarati-medium learners strong in grammar, weak in spoken fluency", "credibility": 0.45 },
    { "type": "public-data", "description": "India EdTech monetization/freemium ARPU benchmarks — 1-5% freemium conversion, low emerging-market ARPU", "credibility": 0.5 }
  ],
  "gaps": [
    "No founder profile: domain expertise, Gujarati-market proximity, distribution, technical (ML/ASR) capability, capital all unknown — biggest unresolved gate.",
    "No hard data on specific Gujarati (not pan-India) TAM/SAM.",
    "No validated monetization/pricing model for this segment; India ARPU structurally low.",
    "Competitor performance depth thin: no churn/retention/DAU/revenue figures for Hello English, Josh Talks, Awal.",
    "No evidence 'Gujarati-first + intermediate-start + game-first + AI' is defensible wedge vs incumbents who could add these features.",
    "Efficacy risk not evidenced: whether gamification sustains motivation at B1+ untested.",
    "Regulatory/pedagogical validation (measurable fluency/CEFR improvement) not addressed."
  ],
  "nextSteps": [
    "Collect founder profile; prioritize evidence of existing Gujarati-learner audience/distribution and ability to solve low-end-device performance + low-ARPU monetization.",
    "Size specific SAM: Gujarati-speaking, smartphone-owning, intermediate English learners; estimate realistic paid-conversion/ARPU using India benchmarks.",
    "Competitive teardown of Hello English, Josh Talks, Awal, ELSA, Duolingo Max on exact wedge to define defensible differentiator and pricing.",
    "Interview 10-15 Gujarati-medium intermediate learners to validate willingness-to-pay and 'game not quiz' preference.",
    "Prototype-test pronunciation-scoring fairness and conversation latency/cost on entry-level Android before committing to build.",
    "Define efficacy metric (measurable CEFR/fluency gain, D30 retention) to validate intermediate-level retention risk."
  ]
}
